{
  "faces": [
    {
      "text": "[click] Drehe diese Identität um.\nDu zahlst 2[credit] weniger, wenn du einen [click] ausgibst, um eine Ressource zu zerstören (nicht durch die Fähigkeit einer Karte).",
      "title": null
    }
  ],
  "id": "sync_everything_everywhere",
  "text": "[click]: Drehe diese Identität um.\nDer Runner zahlt 1[credit] mehr, wenn er einen [click] ausgibt, um eine Markierung zu entfernen (nicht durch die Fähigkeit einer Karte).",
  "title": "SYNC: Alles. Überall."
}
